[
  {
    "schema_version": "0.2.0", "id": "h001",
    "text": "The moral tone is plain.",
    "tokens": ["The", "moral", "tone", "is", "plain", "."],
    "entities": {
      "e1": { "concept": "tone", "number": "sg", "definite": true, "animacy": "abstract", "modifiers": ["moral"] }
    },
    "events": [
      { "id": "ev1", "predicate": "be.attribute", "roles": { "theme": "e1" }, "attribute": "plain",
        "tense": "present", "aspect": "simple", "polarity": "positive", "mood": "declarative" }
    ],
    "alignment": [{ "node": "e1", "tokens": [0, 1, 2] }, { "node": "ev1", "tokens": [3, 4] }]
  },
  {
    "schema_version": "0.2.0", "id": "h002",
    "text": "The man has a pen.",
    "tokens": ["The", "man", "has", "a", "pen", "."],
    "entities": {
      "e1": { "concept": "man", "number": "sg", "definite": true, "animacy": "person", "gender": "male" },
      "e2": { "concept": "pen", "number": "sg", "definite": false, "animacy": "object", "possessor": "e1" }
    },
    "events": [
      { "id": "ev1", "predicate": "have", "roles": { "agent": "e1", "theme": "e2" },
        "tense": "present", "aspect": "simple", "polarity": "positive", "mood": "declarative" }
    ],
    "alignment": [{ "node": "e1", "tokens": [0, 1] }, { "node": "ev1", "tokens": [2] }, { "node": "e2", "tokens": [3, 4] }]
  },
  {
    "schema_version": "0.2.0", "id": "h003",
    "text": "Now Ann can pat Rab.",
    "tokens": ["Now", "Ann", "can", "pat", "Rab", "."],
    "entities": {
      "e1": { "concept": "person", "proper_name": "Ann", "number": "sg", "animacy": "person" },
      "e2": { "concept": "person", "proper_name": "Rab", "number": "sg", "animacy": "person" }
    },
    "events": [
      { "id": "ev1", "predicate": "pat", "roles": { "agent": "e1", "patient": "e2" },
        "tense": "present", "aspect": "simple", "polarity": "positive", "mood": "declarative",
        "modality": "can", "irrealis": true }
    ],
    "setting": { "time": "now" },
    "alignment": [{ "node": "e1", "tokens": [1] }, { "node": "ev1", "tokens": [2, 3] }, { "node": "e2", "tokens": [4] }],
    "notes": "GAP: setting carries no alignment, so Now at token 0 cannot be highlighted. Rab is a dog in the source, but nothing in the sentence says so, so it annotates as a proper name."
  },
  {
    "schema_version": "0.2.0", "id": "h004",
    "text": "He has a pen in his hand.",
    "tokens": ["He", "has", "a", "pen", "in", "his", "hand", "."],
    "entities": {
      "e1": { "concept": "person", "person": "3sg", "gender": "male", "number": "sg", "animacy": "person" },
      "e2": { "concept": "pen", "number": "sg", "definite": false, "animacy": "object", "possessor": "e1" },
      "e3": { "concept": "hand", "number": "sg", "definite": true, "animacy": "object", "possessor": "e1" }
    },
    "events": [
      { "id": "ev1", "predicate": "have", "roles": { "agent": "e1", "theme": "e2" },
        "spatial": { "figure": "e2", "relation": "in", "ground": "e3" },
        "tense": "present", "aspect": "simple", "polarity": "positive", "mood": "declarative" }
    ],
    "alignment": [{ "node": "e1", "tokens": [0] }, { "node": "ev1", "tokens": [1, 4] }, { "node": "e2", "tokens": [2, 3] }, { "node": "e3", "tokens": [5, 6] }]
  },
  {
    "schema_version": "0.2.0", "id": "h005",
    "text": "Yes, if you will sit still.",
    "tokens": ["Yes", ",", "if", "you", "will", "sit", "still", "."],
    "entities": {
      "e1": { "concept": "addressee", "person": "2sg", "number": "sg", "animacy": "person" }
    },
    "events": [
      { "id": "ev1", "predicate": "sit", "roles": { "agent": "e1" },
        "tense": "future", "aspect": "simple", "polarity": "positive", "mood": "declarative", "irrealis": true }
    ],
    "alignment": [{ "node": "e1", "tokens": [3] }, { "node": "ev1", "tokens": [4, 5] }],
    "notes": "Three gaps in one sentence. Yes is a speech act with no home. still is manner, and there is no manner field. The conditional has no consequent clause, so the condition relation has nothing to point at and is omitted."
  },
  {
    "schema_version": "0.2.0", "id": "h006",
    "text": "Tom has a big top, too.",
    "tokens": ["Tom", "has", "a", "big", "top", ",", "too", "."],
    "entities": {
      "e1": { "concept": "person", "proper_name": "Tom", "number": "sg", "animacy": "person" },
      "e2": { "concept": "top", "number": "sg", "definite": false, "animacy": "object", "modifiers": ["big"], "possessor": "e1" }
    },
    "events": [
      { "id": "ev1", "predicate": "have", "roles": { "agent": "e1", "theme": "e2" },
        "tense": "present", "aspect": "simple", "polarity": "positive", "mood": "declarative" }
    ],
    "alignment": [{ "node": "e1", "tokens": [0] }, { "node": "ev1", "tokens": [1] }, { "node": "e2", "tokens": [2, 3, 4] }],
    "notes": "GAP: too is an additive focus particle, one of the 18 Dolch gap words, and is dropped."
  },
  {
    "schema_version": "0.2.0", "id": "h007",
    "text": "Her nest is up on the bank, under the rock.",
    "tokens": ["Her", "nest", "is", "up", "on", "the", "bank", ",", "under", "the", "rock", "."],
    "entities": {
      "e1": { "concept": "person", "person": "3sg", "gender": "female", "number": "sg", "animacy": "person" },
      "e2": { "concept": "nest", "number": "sg", "definite": true, "animacy": "object", "possessor": "e1" },
      "e3": { "concept": "bank.river", "number": "sg", "definite": true, "animacy": "place" }
    },
    "events": [
      { "id": "ev1", "predicate": "be.located", "roles": { "theme": "e2" },
        "spatial": { "figure": "e2", "relation": "on", "ground": "e3" },
        "tense": "present", "aspect": "simple", "polarity": "positive", "mood": "declarative" }
    ],
    "alignment": [{ "node": "e1", "tokens": [0] }, { "node": "e2", "tokens": [0, 1] }, { "node": "ev1", "tokens": [2, 3, 4] }, { "node": "e3", "tokens": [5, 6] }],
    "notes": "GAP: two spatial relations on one event, and the schema allows one. under the rock is dropped entirely, which loses half the picture. bank resolves to the river sense from nest and rock."
  },
  {
    "schema_version": "0.2.0", "id": "h008",
    "text": "The moss is on the rock.",
    "tokens": ["The", "moss", "is", "on", "the", "rock", "."],
    "entities": {
      "e1": { "concept": "moss", "number": "mass", "definite": true, "animacy": "object" },
      "e2": { "concept": "rock", "number": "sg", "definite": true, "animacy": "object" }
    },
    "events": [
      { "id": "ev1", "predicate": "be.located", "roles": { "theme": "e1" },
        "spatial": { "figure": "e1", "relation": "on", "ground": "e2" },
        "tense": "present", "aspect": "simple", "polarity": "positive", "mood": "declarative" }
    ],
    "alignment": [{ "node": "e1", "tokens": [0, 1] }, { "node": "ev1", "tokens": [2, 3] }, { "node": "e2", "tokens": [4, 5] }]
  },
  {
    "schema_version": "0.2.0", "id": "h009",
    "text": "The dear old cow gives us sweet milk to drink.",
    "tokens": ["The", "dear", "old", "cow", "gives", "us", "sweet", "milk", "to", "drink", "."],
    "entities": {
      "e1": { "concept": "cow", "number": "sg", "definite": true, "animacy": "animal", "modifiers": ["dear", "old"] },
      "e2": { "concept": "speaker", "person": "1pl", "number": "pl", "animacy": "person" },
      "e3": { "concept": "milk", "number": "mass", "definite": false, "animacy": "object", "modifiers": ["sweet"] }
    },
    "events": [
      { "id": "ev1", "predicate": "give", "roles": { "agent": "e1", "recipient": "e2", "theme": "e3" },
        "tense": "present", "aspect": "simple", "polarity": "positive", "mood": "declarative" },
      { "id": "ev2", "predicate": "drink", "roles": { "agent": "e2", "patient": "e3" }, "aspect": "simple" }
    ],
    "discourse": [{ "id": "d1", "type": "purpose", "from": "ev1", "to": "ev2", "marker": "to" }],
    "alignment": [
      { "node": "e1", "tokens": [0, 1, 2, 3] }, { "node": "ev1", "tokens": [4] }, { "node": "e2", "tokens": [5] },
      { "node": "e3", "tokens": [6, 7] }, { "node": "ev2", "tokens": [9] }, { "node": "d1", "tokens": [8] }
    ]
  },
  {
    "schema_version": "0.2.0", "id": "h010",
    "text": "Did you call us, mamma?",
    "tokens": ["Did", "you", "call", "us", ",", "mamma", "?"],
    "entities": {
      "e1": { "concept": "addressee", "person": "2sg", "number": "sg", "animacy": "person" },
      "e2": { "concept": "speaker", "person": "1pl", "number": "pl", "animacy": "person" }
    },
    "events": [
      { "id": "ev1", "predicate": "call", "roles": { "agent": "e1", "patient": "e2" },
        "tense": "past", "aspect": "simple", "polarity": "positive", "mood": "interrogative",
        "question": { "type": "yes-no" } }
    ],
    "alignment": [{ "node": "e1", "tokens": [1] }, { "node": "ev1", "tokens": [0, 2] }, { "node": "e2", "tokens": [3] }],
    "notes": "GAP: mamma is a vocative and there is no role for it. Omitted rather than recorded as an entity nothing references."
  },
  {
    "schema_version": "0.2.0", "id": "h011",
    "text": "How fine he looks!",
    "tokens": ["How", "fine", "he", "looks", "!"],
    "entities": {
      "e1": { "concept": "person", "person": "3sg", "gender": "male", "number": "sg", "animacy": "person" }
    },
    "events": [
      { "id": "ev1", "predicate": "look", "roles": { "theme": "e1" }, "attribute": "fine",
        "tense": "present", "aspect": "simple", "polarity": "positive", "mood": "declarative" }
    ],
    "alignment": [{ "node": "e1", "tokens": [2] }, { "node": "ev1", "tokens": [0, 1, 3] }],
    "notes": "GAP: exclamative. mood has declarative, interrogative and imperative only, so How marks a degree the schema cannot hold and the sentence flattens to a statement."
  },
  {
    "schema_version": "0.2.0", "id": "h012",
    "text": "Here, hen, take this little chick under your wing.",
    "tokens": ["Here", ",", "hen", ",", "take", "this", "little", "chick", "under", "your", "wing", "."],
    "entities": {